<!DOCTYPE frame-haug SYSTEM "frame-haug.dtd">

<frame-haug>
    <annotation-scan/>
    <action-classes>
        <action-class class-name="">
            <path></path>
        </action-class>
    </action-classes>

    <actions>
        <action action-path=""></action>
        <action action-path=""></action>
        <action action-path="" action-alias=""></action>
    </actions>


</frame-haug>